market_date,commodity,article_count,positive_count,negative_count,neutral_count,headlines,article_recommendations,latest_entry,earliest_reported_date,latest_reported_date,overall_recommendation
2026-03-12,oil supply,1,0,0,0,"[""China vows to ensure energy security following US military actions""]",[],2026-03-12T05:11:53.984Z,2026-03-03T07:38:48.000Z,2026-03-03T07:38:48.000Z,"Based on the current market data, I recommend that traders hold their oil positions as the lack of sentiment indicators suggests a neutral market outlook, and the headline about China's vow to ensure energy security may lead to potential future supply chain disruptions, but its immediate impact is unclear. Traders should wait for further developments and clearer sentiment signals before making a buy or sell decision, as the current information does not provide a strong basis for a trading move."
2026-03-12,coal,15,1,0,4,"[""Quality is key as some coal rallies amid LNG's spike on Iran war"",""Quality is key as some coal rallies amid LNG's spike on Iran war"",""Quality is key as some coal rallies amid LNG's spike on Iran war"",""Quality is key as some coal rallies amid LNG's spike on Iran war"",""Quality is key as some coal rallies amid LNG's spike on Iran war"",""Quality is key as some coal rallies amid LNG's spike on Iran war"",""India to boost coal use for summer power as Mideast crisis hits LNG supplies"",""Quality is key as some coal rallies amid LNG's spike on Iran war"",""Quality is key as some coal rallies amid LNG's spike on Iran war"",""Quality is key as some coal rallies amid LNG's spike on Iran war"",""Quality is key as some coal rallies amid LNG's spike on Iran war"",""Electricity Monthly Update - U.S. Energy Information Administration"",""Quality is key as some coal rallies amid LNG's spike on Iran war"",""Quality is key as some coal rallies amid LNG's spike on Iran war"",""Quality is key as some coal rallies amid LNG's spike on Iran war""]","[""Traders may consider buying seaborne thermal coal, as the surge in LNG's spot price is expected to continue dragging coal prices higher. This could be a good opportunity to go long on thermal coal, potentially profiting from the anticipated price increase."",""Traders may consider buying thermal coal, as the surge in LNG prices is expected to continue driving up its price. However, a cautious approach is recommended due to the neutral sentiment, and traders should closely monitor market developments before making a decision."",""Traders should buy seaborne thermal coal, particularly higher quality grades, as prices are expected to continue rising due to the surge in LNG prices. This upward trend is likely to persist, making coal a promising commodity to invest in for potential gains."",""Traders may consider buying coal, particularly higher quality grades, as the surge in LNG prices is expected to drive coal prices higher. This could be a good opportunity to go long on coal, taking advantage of the potential price increase in the commodity."",""Traders may consider buying seaborne thermal coal, particularly higher quality grades, as prices are expected to continue higher due to the surge in LNG prices. However, a cautious approach is warranted given the neutral sentiment, and traders should closely monitor market developments before making a trade.""]",2026-03-12T05:11:47.262Z,2026-03-10T06:07:31.000Z,2026-03-10T09:49:01.000Z,"Based on the market data, I recommend holding or buying coal as the dominant positive sentiment and repetitive headlines suggesting a rally in coal prices amid the LNG spike due to the Iran war, indicate a potential increase in demand and price for coal. The lack of negative sentiment and the presence of neutral articles also support a bullish outlook, as they do not indicate any significant downward pressure on coal prices."
2026-03-12,Petroleum,15,0,0,0,"[""Weekly Petroleum Status Report - U.S. Energy Information ..."",""Petroleum & Other Liquids Data"",""Petroleum & Other Liquids Data"",""Petroleum & Other Liquids Data"",""Petroleum & Other Liquids Data - U.S. Energy Information ..."",""Petroleum & Other Liquids Data"",""Petroleum & Other Liquids Data"",""Petroleum & Other Liquids Data"",""Petroleum & Other Liquids Data - U.S. Energy Information ..."",""Petroleum & Other Liquids Data"",""Weekly Petroleum Status Report - U.S. Energy Information ..."",""Petroleum & Other Liquids Data - U.S. Energy Information ..."",""Petroleum & Other Liquids Data"",""Weekly Petroleum Status Report"",""Weekly Petroleum Status Report - U.S. Energy Information ...""]",[],2026-03-12T05:11:48.456Z,null,null,"Based on the provided market data, I recommend that traders hold their positions in petroleum as the lack of sentiment in the 15 articles suggests a neutral market outlook, with no significant positive or negative news to drive price movements. The dominance of data reports from the U.S. Energy Information Administration indicates a focus on factual information rather than market-moving events, which further supports a hold strategy."
2026-03-12,petrol,6,0,6,0,"[""'Inevitable': Warning over UK petrol as gas costs soar and Strait of Hormuz shut"",""'Inevitable': Warning over UK petrol as gas costs soar and Strait of Hormuz shut"",""'Inevitable': Warning over UK petrol as gas costs soar and Strait of Hormuz shut"",""'Inevitable': Warning over UK petrol as gas costs soar and Strait of Hormuz shut"",""'Inevitable': Warning over UK petrol as gas costs soar and Strait of Hormuz shut"",""'Inevitable': Warning over UK petrol as gas costs soar and Strait of Hormuz shut""]","[""Traders should sell crude oil as the conflict in the Middle East is expected to lead to price rises, making it a good time to lock in profits before further increases. Alternatively, traders can short crude oil to capitalize on the anticipated price surge."",""Traders should buy crude oil as the conflict in the Middle East is likely to lead to supply disruptions, driving up prices. Despite the negative sentiment, the expected price direction is up, making it a good opportunity to invest in crude oil."",""Traders should buy crude oil as the conflict in the Middle East is likely to lead to supply disruptions, driving up prices. Despite the negative sentiment, the expected price direction is up, making it a good opportunity to invest in crude oil."",""Traders should buy crude oil as the conflict in the Middle East is expected to drive prices higher, leading to a potential soar in value. This is a bullish trading recommendation, specifically targeting crude oil, as the geopolitical tensions are likely to disrupt supply and push prices up."",""Traders may consider buying Brent crude oil, as the escalating Middle East conflict is likely to drive up prices due to supply concerns. However, traders should be cautious and closely monitor the situation, as prices may be volatile and subject to sudden changes in the conflict's trajectory.""]",2026-03-12T05:11:40.537Z,2026-03-03T08:34:08.000Z,2026-03-03T08:34:08.000Z,"Based on the overwhelmingly negative market sentiment, with all 6 articles having a negative tone, traders are advised to sell or hold petrol as the warnings over soaring gas costs and the Strait of Hormuz shutdown may lead to price increases and supply disruptions. The uniformity of the negative headlines suggests a high level of concern and potential downward pressure on petrol prices, making it a risky time to buy."
2026-03-12,oil and gas projects,1,0,0,0,"[""US eases sanctions to give oil majors broad scope to operate in ...""]",[],2026-03-12T05:11:53.984Z,2026-02-13T21:09:06.000Z,2026-02-13T21:09:06.000Z,"Based on the easing of sanctions to allow oil majors to operate in certain regions, traders may consider buying oil as this development could lead to increased production and investment in the sector, potentially driving up demand and prices. However, it's essential to hold a cautious stance and monitor further market developments, as the actual impact of the sanctions easing on oil prices and production remains to be seen."
2026-03-12,Oil/Gas,2,0,0,0,"[""U.S. Rig Count Data available from Baker Hughes"",""U.S. Rig Count Data available from Baker Hughes""]",[],2026-03-12T05:11:19.446Z,null,null,"Based on the lack of sentiment and limited market data, I recommend that traders hold their positions in oil and gas as there is no clear indication of market trends or shifts in sentiment to inform a buy or sell decision. The availability of U.S. Rig Count Data from Baker Hughes may provide insight into drilling activity, but without further analysis or market reaction, it's prudent to maintain a neutral stance."
2026-03-12,Iranian crude oil and condensates,2,0,0,2,"[""Report on Iranian Petroleum and Petroleum Products Exports"",""Report on Iranian Petroleum and Petroleum Products Exports""]",[],2026-03-12T05:09:58.941Z,null,null,"Based on the neutral market sentiment and lack of positive or negative headlines, traders may consider holding their current positions in Iranian crude oil and condensates as the market data does not indicate a strong trend or significant change in supply and demand. This cautious approach allows traders to wait for more definitive market signals before making a buy or sell decision, minimizing potential risks in a stable but uncertain market environment."
2026-03-12,Brent crude oil,61,0,13,12,"[""Brent crude oil tops $100 a barrel as Iran attacks on shipping worsen supply concerns - WTOP News"",""Brent crude oil tops $100 a barrel as Iran attacks on shipping worsen supply concerns"",""Brent crude oil tops $100 a barrel as Iran attacks on shipping worsen supply concerns - The Boston Globe"",""Brent crude oil jumps above $100 a barrel as Iran's attacks on shipping worsen supply concerns"",""The Latest: Key oil price spikes over $100 as Iranian attacks hit shipping"",""OPEC+ extends deep oil production cuts into 2025 | Reuters"",""Brent crude oil tops $100 a barrel as Iran attacks on shipping worsen supply concerns"",""Brent crude oil tops $100 a barrel as Iran attacks on shipping worsen supply concerns - The Boston Globe"",""Brent crude oil jumps above $100 a barrel as Iran's attacks on shipping worsen supply concerns"",""OPEC+ extends deep oil production cuts into 2025 | Reuters"",""The Latest: Key oil price spikes over $100 as Iranian attacks hit shipping"",""Brent crude oil tops $100 a barrel as Iran attacks on shipping worsen supply concerns"",""Brent crude oil tops $100 a barrel as Iran attacks on shipping worsen supply concerns - The Boston Globe"",""Word of the Week: The price of Brent crude oil is going crazy — but who is ‘Brent’?"",""The Latest: Key oil price spikes over $100 as Iranian attacks hit shipping"",""OPEC+ extends deep oil production cuts into 2025 | Reuters"",""Brent crude oil - Price - Chart - Historical Data - News"",""Brent crude oil tops $100 a barrel as Iran attacks on shipping worsen supply concerns"",""Brent crude oil tops $100 a barrel as Iran attacks on shipping worsen supply concerns - The Boston Globe"",""Word of the Week: The price of Brent crude oil is going crazy — but who is ‘Brent’?"",""The Latest: Key oil price spikes over $100 as Iranian attacks hit shipping"",""OPEC+ extends deep oil production cuts into 2025 | Reuters"",""The Latest: Key oil price spikes over $100 as Iranian attacks hit shipping"",""Brent crude oil tops $100 a barrel as Iran attacks on shipping worsen supply concerns"",""Brent crude oil tops $100 a barrel as Iran attacks on shipping worsen supply concerns - The Boston Globe"",""Brent crude oil jumps above $100 a barrel as Iran's attacks on shipping worsen supply concerns"",""The Latest: Key oil price spikes over $100 as Iranian attacks hit shipping"",""OPEC+ extends deep oil production cuts into 2025 | Reuters"",""Brent crude oil tops $100 a barrel as Iran attacks on shipping worsen supply concerns"",""Brent crude oil tops $100 a barrel as Iran attacks on shipping worsen supply concerns - The Boston Globe"",""Word of the Week: The price of Brent crude oil is going crazy — but who is ‘Brent’?"",""OPEC+ extends deep oil production cuts into 2025 | Reuters"",""Brent crude oil - Price - Chart - Historical Data - News"",""Brent crude oil tops $100 a barrel as Iran attacks on shipping worsen supply concerns"",""Brent crude oil tops $100 a barrel as Iran attacks on shipping worsen supply concerns - The Boston Globe"",""Brent crude oil jumps above $100 a barrel as Iran's attacks on shipping worsen supply concerns"",""The Latest: Key oil price spikes over $100 as Iranian attacks hit shipping"",""Brent crude oil - Price - Chart - Historical Data - News"",""Brent crude oil tops $100 a barrel as Iran attacks on shipping worsen supply concerns"",""Brent crude oil tops $100 a barrel as Iran attacks on shipping worsen supply concerns - The Boston Globe"",""Word of the Week: The price of Brent crude oil is going crazy — but who is ‘Brent’?"",""The Latest: Key oil price spikes over $100 as Iranian attacks hit shipping"",""Brent crude oil - Price - Chart - Historical Data - News"",""Brent crude oil tops $100 a barrel as Iran attacks on shipping worsen supply concerns"",""Word of the Week: The price of Brent crude oil is going crazy — but who is ‘Brent’?"",""The Latest: Key oil price spikes over $100 as Iranian attacks hit shipping"",""Brent crude oil tops $100 a barrel as Iran attacks on shipping worsen supply concerns"",""Word of the Week: The price of Brent crude oil is going crazy — but who is ‘Brent’?"",""The Latest: Key oil price spikes over $100 as Iranian attacks hit shipping"",""Brent crude oil tops $100 a barrel as Iran attacks on shipping worsen supply concerns"",""Brent crude oil jumps above $100 a barrel as Iran's attacks on shipping worsen supply concerns"",""Word of the Week: The price of Brent crude oil is going crazy — but who is ‘Brent’?"",""The Latest: Key oil price spikes over $100 as Iranian attacks hit shipping"",""Brent crude oil - Price - Chart - Historical Data - News"",""Brent crude oil - Price - Chart - Historical Data - News"",""Brent crude oil - Price - Chart - Historical Data - News"",""The Latest: Key oil price spikes over $100 as Iranian attacks hit shipping"",""Short-Term Energy Outlook"",""Brent crude oil - Price - Chart - Historical Data - News"",""Brent crude oil tops $100 a barrel as Iran attacks on shipping worsen supply concerns"",""Brent crude oil jumps above $100 a barrel as Iran's attacks on shipping worsen supply concerns""]","[""Traders should buy oil as supply concerns and geopolitical tensions in the Strait of Hormuz are driving prices higher. This bullish momentum is expected to continue, making oil a promising commodity to invest in for potential short-term gains."",""Traders may consider buying Brent crude oil as the recent jump above $100 a barrel, driven by worsening supply concerns due to Iran's attacks on shipping, may indicate further price increases. However, a cautious approach is advised due to the neutral sentiment, and traders should closely monitor the situation for potential reversals in the commodity's price direction."",""Traders may consider buying Brent crude oil as its price is expected to continue its upward trend, having recently topped $100 a barrel. However, caution is advised due to the recent volatility, and traders should closely monitor the market for any signs of a potential reversal."",""Traders may consider buying oil as prices are expected to continue higher due to worsening supply concerns sparked by Iranian attacks on commercial shipping. This bullish sentiment suggests that oil prices will likely remain elevated in the short term, making it a potentially profitable trade."",""Traders may consider buying Brent crude oil as the recent jump above $100 a barrel, driven by worsening supply concerns due to Iran's attacks on shipping, may indicate further price increases. However, a cautious approach is advised due to the neutral sentiment, and traders should closely monitor the situation for potential reversals in the commodity's price direction."",""Based on the article, traders are recommended to sell Brent crude oil as the extended production cuts and current price near $80 per barrel may lead to a downward price movement. Traders should consider shorting Brent crude oil, anticipating a potential drop below the current price level."",""Traders may consider buying Brent crude oil as the current supply concerns are driving prices upward, potentially leading to further gains. However, a cautious approach is recommended due to the neutral sentiment, and traders should be prepared to adjust their positions if market conditions change."",""Traders may consider buying oil as prices are expected to continue higher due to worsening supply concerns. This is a speculative play, and traders should be prepared for potential volatility as the situation around the Strait of Hormuz develops."",""Traders may consider buying Brent crude oil as the recent supply concerns caused by Iran attacks are likely to continue driving prices up. However, a cautious approach is recommended due to the neutral market sentiment, and traders should be prepared to adjust their positions if the situation changes."",""Traders should buy oil as supply concerns and geopolitical tensions in the Strait of Hormuz are driving prices higher, with oil already experiencing a significant 9% increase. This upward momentum is likely to continue, making oil a promising commodity to invest in for potential short-term gains."",""Traders should buy oil as supply concerns and geopolitical tensions in the Strait of Hormuz are driving prices higher. Despite the overall negative sentiment, the current market conditions suggest that oil prices will continue to rise, making it a good opportunity for traders to take a long position."",""Traders are recommended to sell Brent oil as the negative sentiment and downward price direction suggest a continued decline in price. Holders of long positions in Brent oil may also consider closing their positions to avoid potential further losses."",""Traders should buy oil as supply concerns and geopolitical tensions in the Strait of Hormuz are driving prices higher. This bullish momentum is expected to continue, making oil a favorable commodity to invest in for potential short-term gains."",""Traders may consider buying Brent crude oil as the recent jump above $100 a barrel, driven by worsening supply concerns due to Iran's attacks on shipping, may indicate further price increases. However, a cautious approach is advised due to the neutral sentiment, and traders should closely monitor the situation for potential reversals in the commodity's price direction."",""Traders should buy oil as supply concerns and geopolitical tensions in the Strait of Hormuz are driving prices higher. Despite the overall negative sentiment, the current market conditions suggest that oil prices will continue to rise, making it a good opportunity for traders to take a long position."",""Traders should buy Brent crude oil as the recent attacks on shipping by Iran have worsened supply concerns, driving the price up. However, given the volatility and recent spike near $120, traders should be cautious and consider taking profits if the price approaches that level again."",""Traders may consider buying Brent crude oil as the commodity has topped $100 a barrel, driven by worsening supply concerns due to Iran's attacks on shipping. However, a cautious approach is advised as the situation is volatile, and traders should be prepared for potential price fluctuations in the oil market."",""Traders may consider buying Brent crude oil as the commodity's price has jumped above $100 a barrel due to worsening supply concerns. However, this is a short-term opportunistic trade, as the overall sentiment remains negative and the price increase is driven by geopolitical tensions rather than fundamental demand.""]",2026-03-12T05:11:45.999Z,2024-06-03T04:25:06.000Z,2026-03-12T04:02:22.000Z,"Based on the market data, I recommend that traders hold or consider buying Brent crude oil as the price has spiked above $100 a barrel due to worsening supply concerns caused by Iran's attacks on shipping, and OPEC+'s extension of deep oil production cuts into 2025 is likely to further support prices. The overwhelmingly negative and neutral sentiment, with no positive articles, suggests that the market may be overreacting to the supply concerns, potentially creating a buying opportunity for traders who believe the price will continue to rise."
2026-03-12,shale gas,9,0,0,2,"[""U.S. shale gas production outlook 2050| Statista"",""U.S. shale gas production outlook 2050| Statista"",""U.S. shale gas production outlook 2050| Statista"",""U.S. shale gas production outlook 2050| Statista"",""U.S. shale gas production outlook 2050| Statista"",""U.S. shale gas production outlook 2050| Statista"",""U.S. shale gas production outlook 2050| Statista"",""U.S. shale gas production outlook 2050| Statista"",""Slowing US Shale Growth Has Fracking Companies Finding New Markets ...""]","[""Based on the forecasted increase in shale gas and tight oil production in the United States, traders may consider buying natural gas and crude oil as the expected increase in production could lead to higher prices. Specifically, traders can look to buy natural gas, as the significant increase in production to 35 trillion cubic feet by 2050 may drive up demand and prices for the commodity."",""Based on the neutral sentiment and decreasing price direction, traders may consider selling or holding crude oil, as the slowing US shale growth may lead to decreased production and potentially lower prices. It's likely a good time to sell crude oil or hold existing positions, but avoid buying, as the market trend appears to be downward.""]",2026-03-12T05:11:49.000Z,null,null,"Based on the neutral sentiment and repetitive headlines focused on the long-term production outlook, traders may consider holding their positions in shale gas as the market data does not indicate a strong bullish or bearish trend. The lack of positive or negative sentiment suggests stability, and the sole varying headline mentioning ""Slowing US Shale Growth"" could be a concern, but without more negative articles, it's not a clear sell signal."
2026-03-12,Iranian petroleum,1,0,0,0,"[""Treasury Dismantles Key Elements of Iran’s Energy Export Machine ...""]",[],2026-03-12T05:08:59.748Z,2025-10-09T00:00:00.000Z,2025-10-09T00:00:00.000Z,"Based on the market data, I recommend that traders sell Iranian petroleum as the dismantling of key elements of Iran's energy export machine, as indicated by the headline, is likely to disrupt supply and create uncertainty in the market. This potential disruption could lead to a decrease in the value of Iranian petroleum, making it a good time to sell before prices drop further."
