market_date,commodity,article_count,positive_count,negative_count,neutral_count,headlines,article_recommendations,latest_entry,earliest_reported_date,latest_reported_date,overall_recommendation
2026-03-12,Brent,11,0,9,0,"[""Brent crude oil - Price - Chart - Historical Data - News"",""Brent Falls Below $90 as Trump Signals War May End | OilPrice.com"",""Brent crude oil - Price - Chart - Historical Data - News"",""Brent Falls Below $90 as Trump Signals War May End | OilPrice.com"",""Brent Falls Below $90 as Trump Signals War May End | OilPrice.com"",""Brent Falls Below $90 as Trump Signals War May End | OilPrice.com"",""Brent Falls Below $90 as Trump Signals War May End | OilPrice.com"",""Brent Falls Below $90 as Trump Signals War May End | OilPrice.com"",""Brent Falls Below $90 as Trump Signals War May End | OilPrice.com"",""Brent Falls Below $90 as Trump Signals War May End | OilPrice.com"",""Brent Falls Below $90 as Trump Signals War May End | OilPrice.com""]","[""Traders are recommended to sell Brent oil as the negative sentiment and downward price direction suggest a continued decline in price. Holders of long positions in Brent oil may also consider closing their positions to avoid potential further losses."",""Traders should sell oil as the escalating conflict in the Middle East poses a significant threat to the region's energy supply, which could lead to further price volatility. Despite the recent surge, the overall sentiment remains negative, suggesting that oil prices may fall in the near term."",""Traders should sell oil as the escalating conflict in the Middle East poses a significant threat to the region's energy supply, which could lead to further price volatility. Despite the recent surge, the overall sentiment remains negative, suggesting that oil prices may fall in the near term."",""Traders should sell oil as the escalating conflict in the Middle East poses a significant threat to the region's energy supply, which could lead to further price volatility. Despite the recent surge, the overall sentiment remains negative, suggesting that oil prices may fall in the near term."",""Traders should sell oil as the escalating conflict in the Middle East poses a significant threat to the region's energy supply, which could lead to further price volatility. Despite the recent surge, the overall sentiment remains negative, suggesting that oil prices may fall in the near term."",""Traders should sell oil as the escalating conflict in the Middle East poses a significant threat to the region's energy supply, which could lead to further price volatility. Despite the recent surge, the overall sentiment remains negative, suggesting that oil prices may fall in the near term."",""Traders should sell oil as the escalating conflict in the Middle East poses a significant threat to the region's energy supply, which could lead to further price volatility. Despite the recent surge, the overall sentiment remains negative, suggesting that oil prices may fall in the near term."",""Traders should sell oil as the escalating conflict in the Middle East poses a significant threat to the region's energy supply, which could lead to further price volatility. Despite the recent surge, the overall sentiment remains negative, suggesting that oil prices may fall in the near term."",""Traders should sell oil as the escalating conflict in the Middle East poses a significant threat to the region's energy supply, which could lead to further price volatility. Despite the recent surge, the overall sentiment remains negative, suggesting that oil prices may fall in the near term.""]",2026-03-12T05:11:23.116Z,2026-03-09T22:29:46.000Z,2026-03-09T22:29:46.000Z,"Based on the overwhelmingly negative market sentiment, with 9 out of 11 articles having a negative tone, I recommend that traders sell or hold Brent crude oil as the price has already fallen below $90, potentially indicating further downward pressure. The repeated headlines suggesting Brent's decline in response to Trump's signals of a potential end to war also imply a bearish outlook, making it a unfavorable time to buy the commodity."
2026-03-12,U.S. Oil,11,0,9,0,"[""The Status of U.S. Oil Production: 2024 Update"",""The Status of U.S. Oil Production: 2024 Update"",""The Status of U.S. Oil Production: 2024 Update"",""The Status of U.S. Oil Production: 2024 Update"",""The Status of U.S. Oil Production: 2024 Update"",""The Status of U.S. Oil Production: 2024 Update"",""The Status of U.S. Oil Production: 2024 Update"",""The Status of U.S. Oil Production: 2024 Update"",""The Status of U.S. Oil Production: 2024 Update"",""The Status of U.S. Oil Production: 2024 Update"",""The Status of U.S. Oil Production: 2024 Update""]","[""Traders are recommended to sell oil, as the warnings from prominent petroleum geologists about resource limitations suggest a potential decline in oil prices. This bearish sentiment may lead to a downward price direction, making it a good time to short oil or close out any long positions in the commodity."",""Traders are recommended to sell crude oil as the warnings from prominent petroleum geologists about resource limitations suggest a potential decline in oil prices. This bearish sentiment may lead to a downward price direction, making it a good time to short crude oil or exit long positions."",""Traders are recommended to sell crude oil as the warnings from prominent petroleum geologists about resource limitations suggest a potential decline in oil prices. This bearish sentiment may lead to a downward price direction, making it a good time to short crude oil or exit any long positions."",""Traders are recommended to sell crude oil as the warnings from prominent petroleum geologists about resource limitations suggest a potential decline in oil prices. This bearish sentiment may lead to a downward price direction, making it a good time to short crude oil or exit long positions."",""Traders are recommended to sell crude oil as the warnings from prominent petroleum geologists about resource limitations suggest a potential decline in oil prices. This bearish sentiment may lead to a downward price direction, making it a good time to short crude oil or exit long positions.""]",2026-03-12T05:11:06.417Z,2024-07-03T13:36:03.000Z,2024-07-03T13:36:03.000Z,"Based on the overwhelmingly negative sentiment from the 11 articles, with 9 having negative sentiment and none being positive, traders are advised to sell U.S. Oil as the market outlook appears bearish. The lack of diversity in headlines, all being about the status of U.S. oil production in 2024, suggests a consistent and potentially concerning narrative that may be driving down prices, further supporting the decision to sell."
2026-03-12,Iranian petroleum and petrochemical products,2,0,1,0,"[""Sanctioning Entities Trading in Iranian Petroleum and Petrochemicals"",""Sanctioning Entities Trading in Iranian Petroleum and Petrochemicals""]",[],2026-03-12T05:10:13.209Z,2025-10-09T15:49:49.000Z,2025-10-09T15:49:49.000Z,"Based on the negative market sentiment due to the sanctioning of entities trading in Iranian petroleum and petrochemicals, traders are advised to sell or hold this commodity as the sanctions may lead to reduced demand and potential supply chain disruptions. The lack of positive sentiment and presence of negative headlines suggest a bearish outlook for Iranian petroleum and petrochemical products, making it a risky investment at this time."
2026-03-12,Iranian Oil,7,0,0,1,"[""Sanctions to Combat Illicit Traders of Iranian Oil and the Shadow ..."",""Sanctions to Combat Illicit Traders of Iranian Oil and the Shadow ..."",""Sanctions to Combat Illicit Traders of Iranian Oil and the Shadow ..."",""Iran Sanctions | Office of Foreign Assets Control"",""Sanctions to Combat Illicit Traders of Iranian Oil and the Shadow ..."",""Iran Sanctions | Office of Foreign Assets Control"",""Sanctions to Combat Illicit Traders of Iranian Oil and the Shadow ...""]",[],2026-03-12T05:11:37.725Z,2026-02-10T14:37:56.000Z,2026-02-10T14:37:56.000Z,"Based on the market data, I recommend that traders hold Iranian Oil as the neutral sentiment and repetitive headlines regarding sanctions to combat illicit traders suggest a stable but uncertain market environment, with no clear indication of a price increase or decrease. The lack of positive or negative sentiment in the articles implies that the market is not expecting any significant changes in the near term, making it a good idea to maintain current positions rather than taking new trades."
2026-03-12,U.S. crude oil,1,0,0,0,"[""STEO March 2026 Short-Term Energy Outlook""]",[],2026-03-12T05:11:50.192Z,null,null,"Based on the lack of sentiment and limited market data, I recommend that traders hold their positions in U.S. crude oil as the neutral outlook from the STEO March 2026 Short-Term Energy Outlook does not provide a clear direction for price movement. Without positive or negative sentiment to influence the market, it's best to wait for more definitive indicators before making a buy or sell decision."
2026-03-12,gasoline,46,2,12,7,"[""U.S. retail gasoline prices to decrease in 2025 and 2026 with lower ..."",""U.S. refineries in 2025: 10 key facts you should know - Home"",""Carbon Tax Basics"",""Furious Californians slam Gavin Newsom’s stealth plan that will bring even more gas price hikes: ‘Taxing us to death’"",""Gasoline prices and outlook - U.S. Energy Information Administration"",""Furious Californians slam Gavin Newsom’s stealth plan that will bring even more gas price hikes: ‘Taxing us to death’"",""Fuel price surge would be worse without Trump energy policies: Burgum"",""STEO March 2026 Short-Term Energy Outlook"",""U.S. retail gasoline prices to decrease in 2025 and 2026 with lower ..."",""Higher gasoline prices, volatile stocks, could hit both low- and high-income US consumers as war persists"",""2025 Fuel Price Forecast"",""Higher gasoline prices, volatile stocks, could hit both low- and high-income US consumers as war persists"",""U.S. retail gasoline prices to decrease in 2025 and 2026 with lower ..."",""U.S. gasoline export increased slightly in 2025 - BIC Magazine"",""STEO March 2026 Short-Term Energy Outlook"",""Higher gasoline prices, volatile stocks, could hit both low- and high-income US consumers as war persists"",""Furious Californians slam Gavin Newsom’s stealth plan that will bring even more gas price hikes: ‘Taxing us to death’"",""STEO March 2026 Short-Term Energy Outlook"",""Higher gasoline prices, volatile stocks, could hit both low- and high-income US consumers as war persists"",""Furious Californians slam Gavin Newsom’s stealth plan that will bring even more gas price hikes: ‘Taxing us to death’"",""Higher gasoline prices, volatile stocks, could hit both low- and high-income US consumers as war persists"",""Higher gasoline prices, volatile stocks, could hit both low- and high-income US consumers as war persists"",""Q4 2025 Refinery Outages: 12 Critical Impacts & Logistics Pressures"",""Carbon tax - Wikipedia"",""Furious Californians slam Gavin Newsom’s stealth plan that will bring even more gas price hikes: ‘Taxing us to death’"",""U.S. retail gasoline prices to decrease in 2025 and 2026 with lower ..."",""Furious Californians slam Gavin Newsom’s stealth plan that will bring even more gas price hikes: ‘Taxing us to death’"",""U.S. gasoline export increased slightly in 2025 - BIC Magazine"",""2025 Fuel Price Forecast"",""STEO March 2026 Short-Term Energy Outlook"",""U.S. retail gasoline prices to decrease in 2025 and 2026 with lower ..."",""Furious Californians slam Gavin Newsom’s stealth plan that will bring even more gas price hikes: ‘Taxing us to death’"",""Short-Term Energy Outlook - U.S. Energy Information Administration"",""Higher gasoline prices, volatile stocks, could hit both low- and high-income US consumers as war persists"",""Carbon Tax Basics"",""Furious Californians slam Gavin Newsom’s stealth plan that will bring even more gas price hikes: ‘Taxing us to death’"",""Short-Term Energy Outlook - U.S. Energy Information Administration"",""STEO March 2026 Short-Term Energy Outlook"",""Nigeria prioritises local gasoline supply, suspends import licences"",""February CPI Report: The Calm Before March’s Expected Gasoline Spike (NYSEARCA:SPY)"",""Furious Californians slam Gavin Newsom’s stealth plan that will bring even more gas price hikes: ‘Taxing us to death’"",""Pennsylvania bills would suspend gas taxes amid Iran war"",""Short-Term Energy Outlook - U.S. Energy Information Administration"",""Nigeria prioritises local gasoline supply, suspends import licences"",""Higher gasoline prices, volatile stocks, could hit both low- and high-income US consumers as war persists"",""Nigeria prioritises local gasoline supply, suspends import licences""]","[""Traders may consider selling gasoline futures as the expected price hikes due to Gavin Newsom's plan may already be factored into current prices, and negative sentiment could lead to a reversal. However, given the current upward price direction, a more cautious approach would be to hold existing positions in gasoline futures and wait for further market developments before making any new trades."",""Based on the projected decrease in gasoline spending, traders may consider selling gasoline futures as the price direction is expected to be less, indicating a potential decline in value. This could be a good opportunity to short gasoline, potentially profiting from the anticipated decrease in demand and subsequent price drop."",""Based on the neutral sentiment and slight increase in U.S. gasoline exports, traders may consider holding their current positions in gasoline, as the market does not appear to be experiencing significant volatility or trend changes. There is no strong indication to buy or sell gasoline at this time, making a hold strategy the most prudent approach."",""Traders may consider selling gasoline futures as higher prices are expected to negatively impact US consumers, potentially leading to decreased demand. However, traders could also consider buying oil futures, as the ongoing war and volatile market sentiment may continue to drive prices higher for crude oil."",""Traders may consider selling gasoline futures as higher prices are expected to negatively impact US consumers, potentially leading to decreased demand. However, traders could also consider buying oil futures, such as WTI crude, as the ongoing war and volatile market sentiment may continue to support rising prices."",""Traders may consider selling gasoline futures as the expected price hikes due to Gavin Newsom's plan may already be factored into current prices, and negative sentiment could lead to a reversal. However, given the current upward price direction, a more cautious approach would be to hold existing positions in gasoline futures and wait for further market developments before making any new trades."",""Based on the neutral sentiment and slight increase in U.S. gasoline exports, traders may consider holding their positions in gasoline, as the market does not show a strong trend in either direction. There is no clear indication to buy or sell, so a cautious approach and holding current positions in gasoline is recommended."",""Based on the projected decrease in gasoline spending, traders may consider selling gasoline futures as the price direction is expected to be less, indicating a potential decline in demand and subsequently, price. This could be a good opportunity to short gasoline, potentially profiting from the anticipated downward trend in the commodity's price."",""Traders are recommended to sell gasoline, as the expected increase in inventories in 2026 may lead to downward pressure on prices. This downward trend is likely to continue, making it a good time to short gasoline or avoid long positions in the commodity."",""Based on the potential for tightening caps on greenhouse gas emissions to drive up costs, traders may consider buying gasoline and diesel contracts, as prices are expected to rise. However, this is a speculative play and traders should be cautious, as the actual impact of the emissions caps on prices is uncertain."",""Traders are recommended to sell gasoline, as the expected increase in inventories in 2026 may lead to downward pressure on prices. This downward trend is likely to continue, making it a good time to short gasoline or avoid long positions in the commodity."",""Based on the neutral sentiment and upward price direction, traders may consider buying crude oil as the market appears to be trending positively. However, given the neutral sentiment, a cautious approach may be warranted, and traders should be prepared to hold or adjust their positions if market conditions change."",""Traders may consider selling gasoline futures as the expected price hikes due to Gavin Newsom's plan may already be factored into current prices, and negative sentiment could lead to a reversal. However, given the current upward price direction, a more cautious approach would be to hold existing positions in gasoline futures and wait for further market developments before making any trades."",""Traders should sell gasoline, as the expected increase in inventories in 2026 is likely to put downward pressure on prices. This downward trend may lead to decreased refiner and retail margins, making it a good time to short gasoline or reduce long positions.""]",2026-03-12T05:11:58.375Z,2025-01-09T17:19:29.000Z,2026-03-12T01:38:29.000Z,"Based on the market data, I recommend that traders hold or sell gasoline as the overall sentiment is bearish, with 12 negative articles and repeated mentions of potential price hikes due to taxes and war, which could lead to decreased demand and lower prices. The few positive articles mentioning decreased prices in 2025 and 2026 are outweighed by the numerous negative headlines, suggesting that traders should exercise caution and avoid buying into the commodity at this time."
2026-03-12,liquefied natural gas (LNG) cargoes,1,0,0,0,"[""Natural Gas Weekly Update""]",[],2026-03-12T05:08:22.759Z,null,null,"Based on the lack of sentiment and limited market data, I recommend that traders hold their LNG positions for now, as there is insufficient information to make an informed decision to buy or sell. The neutral sentiment and absence of positive or negative news suggests that the market is stable, and traders should wait for more significant developments or trends to emerge before making a trading decision."
2026-03-12,wind and solar energy,10,10,0,0,"[""Editorial: Virginia’s moves to make wind, solar more affordable look to the future"",""Editorial: Virginia’s moves to make wind, solar more affordable look to the future"",""Editorial: Virginia’s moves to make wind, solar more affordable look to the future"",""Editorial: Virginia’s moves to make wind, solar more affordable look to the future"",""Editorial: Virginia’s moves to make wind, solar more affordable look to the future"",""Editorial: Virginia’s moves to make wind, solar more affordable look to the future"",""Editorial: Virginia’s moves to make wind, solar more affordable look to the future"",""Editorial: Virginia’s moves to make wind, solar more affordable look to the future"",""Editorial: Virginia’s moves to make wind, solar more affordable look to the future"",""Editorial: Virginia’s moves to make wind, solar more affordable look to the future""]",[],2026-03-12T05:11:02.817Z,2026-03-11T18:15:51.000Z,2026-03-11T18:15:51.000Z,"Based on the overwhelmingly positive sentiment towards wind and solar energy, with 10 positive articles and no negative or neutral sentiments, I recommend that traders buy or hold renewable energy-related commodities, as the bullish trend suggests increasing demand and support for these alternatives to oil and gas. The consistent editorial praise for Virginia's efforts to make wind and solar energy more affordable indicates a growing shift towards cleaner energy sources, which may lead to increased investment and growth in the renewable energy sector."
2026-03-12,liquid fuels,13,0,0,0,"[""STEO November 2025 Short-Term Energy Outlook"",""STEO November 2025 Short-Term Energy Outlook"",""STEO November 2025 Short-Term Energy Outlook"",""STEO November 2025 Short-Term Energy Outlook"",""STEO November 2025 Short-Term Energy Outlook"",""STEO November 2025 Short-Term Energy Outlook"",""STEO November 2025 Short-Term Energy Outlook"",""STEO September 2025 Short-Term Energy Outlook"",""STEO November 2025 Short-Term Energy Outlook"",""STEO November 2025 Short-Term Energy Outlook"",""STEO November 2025 Short-Term Energy Outlook"",""STEO November 2025 Short-Term Energy Outlook"",""STEO November 2025 Short-Term Energy Outlook""]",[],2026-03-12T05:11:07.638Z,null,null,"Based on the provided market data, I recommend that traders hold their positions in liquid fuels as the lack of sentiment and repetitive headlines from the Short-Term Energy Outlook (STEO) reports do not provide any clear direction or insight to make an informed buying or selling decision. The absence of positive, negative, or neutral sentiment suggests a neutral market outlook, making it prudent for traders to maintain their current positions and await more conclusive market indicators."
2026-03-12,"oil, gas, and electric",2,0,0,0,"[""Geopolitics of Energy in 2026: Global shifts & implications"",""Geopolitics of Energy in 2026: Global shifts & implications""]",[],2026-03-12T05:11:55.746Z,2026-03-07T03:26:25.000Z,2026-03-07T03:26:25.000Z,"Based on the neutral market data with no positive or negative sentiment, I recommend that traders hold their positions in oil, gas, and electric commodities as the lack of sentiment indicates no significant changes or trends in the market. The duplicate headlines suggesting a focus on geopolitical shifts imply that traders should wait for more concrete developments before making any major buying or selling decisions."
2026-03-12,crude,18,2,1,5,"[""Prediction: Energy Stocks Outperform if Crude Holds Near $100 a Barrel | The Motley Fool"",""OPEC crude production up 164,000 barrels per day in February"",""U.S. refineries in 2025: 10 key facts you should know - Home"",""US crude stocks rise, fuel inventories fall on higher demand, EIA says"",""Prediction: Energy Stocks Outperform if Crude Holds Near $100 a Barrel | The Motley Fool"",""Organization of the Petroleum Exporting Countries 12 August 2025"",""Refinery status monthly - September | Kpler - Sep 24, 2025"",""Prediction: Energy Stocks Outperform if Crude Holds Near $100 a Barrel | The Motley Fool"",""Prediction: Energy Stocks Outperform if Crude Holds Near $100 a Barrel | The Motley Fool"",""OPEC Digital Publications - Monthly Oil Market Report"",""Prediction: Energy Stocks Outperform if Crude Holds Near $100 a Barrel | The Motley Fool"",""Prediction: Energy Stocks Outperform if Crude Holds Near $100 a Barrel | The Motley Fool"",""Prediction: Energy Stocks Outperform if Crude Holds Near $100 a Barrel | The Motley Fool"",""US crude stocks rise, fuel inventories fall on higher demand, EIA says"",""Prediction: Energy Stocks Outperform if Crude Holds Near $100 a Barrel | The Motley Fool"",""US crude stocks rise, fuel inventories fall on higher demand, EIA says"",""Prediction: Energy Stocks Outperform if Crude Holds Near $100 a Barrel | The Motley Fool"",""Iran war threatens prolonged hit to global energy markets | Reuters""]","[""Based on the neutral sentiment and rising price direction, traders may consider buying US crude oil as the higher demand and falling fuel inventories could continue to support price gains. However, traders should be cautious and closely monitor the market as the rising US crude stocks could potentially put downward pressure on prices."",""Traders should buy oil as the geopolitical conflict in the Middle East is expected to continue driving prices up. This upward momentum makes oil a promising commodity to invest in, with potential for further gains as the conflict unfolds."",""Traders should buy oil as the geopolitical conflict in the Middle East is expected to continue driving prices up. This upward momentum makes oil a promising commodity to invest in, with potential for further gains as the conflict unfolds."",""Based on the neutral sentiment and rising price direction, traders may consider buying US crude oil as the higher demand and falling fuel inventories could continue to support price gains. However, traders should be cautious and closely monitor the market as the rising US crude stocks could potentially put downward pressure on prices."",""Based on the neutral sentiment and rising price direction, traders may consider buying US crude oil as the higher demand and falling fuel inventories could continue to support price gains. However, traders should exercise caution and closely monitor the market as the rising US crude stocks could potentially offset some of the bullish momentum.""]",2026-03-12T05:11:55.135Z,2025-07-01T05:10:51.000Z,2026-03-11T16:15:06.000Z,"Based on the market data, I recommend holding crude oil positions as the overall sentiment is neutral with a slight positive bias, driven by predictions of energy stocks outperforming if crude holds near $100 a barrel, but caution is warranted due to the potential disruption to global energy markets from the Iran war. The recent rise in US crude stocks and higher demand also suggest a stable market, making a hold position the most prudent strategy at this time."
