market_date,commodity,article_count,positive_count,negative_count,neutral_count,headlines,article_recommendations,latest_entry,earliest_reported_date,latest_reported_date,overall_recommendation
2026-03-12,Natural Gas,32,0,0,1,"[""Natural Gas Imports and Exports Monthly 2025 | Department of Energy"",""Natural Gas Weekly Update"",""NATURAL GAS PRICE FORECAST 2026, 2027, 2028 AND 2029 - Long Forecast"",""Natural Gas Weekly Update"",""Natural Gas Weekly Update"",""Natural Gas Imports and Exports Monthly 2025 | Department of Energy"",""NATURAL GAS PRICE FORECAST 2026, 2027, 2028 AND 2029 - Long Forecast"",""Natural Gas Weekly Update"",""Natural Gas Imports and Exports Monthly 2025 | Department of Energy"",""Natural Gas Weekly Update"",""NATURAL GAS PRICE FORECAST 2026, 2027, 2028 AND 2029 - Long Forecast"",""Natural Gas Weekly Update"",""Natural Gas Weekly Update"",""Natural Gas Imports and Exports Monthly 2025 | Department of Energy"",""NATURAL GAS PRICE FORECAST 2026, 2027, 2028 AND 2029 - Long Forecast"",""Natural Gas Market Indicators - June 20, 2025 - American Gas ..."",""Natural Gas Imports and Exports Monthly 2025 | Department of Energy"",""Natural Gas Imports and Exports Monthly 2025 | Department of Energy"",""Henry Hub Natural Gas Futures Overview"",""Natural Gas Weekly Update"",""Natural Gas Weekly Update"",""Natural Gas Imports and Exports Monthly 2025 | Department of Energy"",""Natural Gas Imports and Exports Monthly 2025 | Department of Energy"",""Natural Gas Weekly Update"",""Natural Gas Weekly Update"",""Natural Gas Weekly Update"",""Natural Gas Weekly Update"",""Big Freeze Disrupts U.S. Oil and Gas Production ... U.S. Natural Gas Prices Retreat After Rallying 117%"",""Natural Gas Feb '26 Futures Price - Barchart.com"",""Natural Gas Weekly Update"",""NATURAL GAS PRICE FORECAST 2026, 2027, 2028 AND 2029 - Long Forecast"",""Natural Gas Weekly Update""]",[],2026-03-12T05:11:47.262Z,2025-06-20T16:52:20.000Z,2026-01-15T02:15:01.000Z,"Based on the neutral sentiment and lack of positive or negative articles, traders may consider holding their current natural gas positions as the market appears to be stable with no significant drivers for a major price shift. The repetition of ""Natural Gas Weekly Update"" and ""NATURAL GAS PRICE FORECAST"" headlines suggests a focus on routine market analysis rather than any breaking news or trends that would warrant a buy or sell decision."
2026-03-12,Brent Crude Oil,33,0,0,0,"[""Brent Crude Oil Futures Quotes"",""Brent Crude Oil Futures Contracts | Oilprice.com"",""Brent Crude Oil Futures Quotes"",""Brent Crude Oil Futures Price Today - Investing.com"",""Brent Crude Oil Futures Price Today - Investing.com"",""Brent Crude Oil Futures Contracts | Oilprice.com"",""Brent Crude Oil Futures Quotes"",""Brent Crude Oil Futures Contracts | Oilprice.com"",""Brent Crude Oil Futures Quotes"",""Brent Crude Oil Futures Contracts | Oilprice.com"",""Brent Crude Oil Futures Price Today - Investing.com"",""Brent Crude Oil Futures Quotes"",""Brent Crude Oil Futures Contracts | Oilprice.com"",""Brent Crude Oil Futures Price Today - Investing.com"",""Brent Crude Oil Futures Quotes"",""Brent Crude Oil Futures Contracts | Oilprice.com"",""Brent Crude Oil Futures Price Today - Investing.com"",""Brent Crude Oil Futures Quotes"",""Brent Crude Oil Futures Contracts | Oilprice.com"",""Brent Crude Oil Futures Quotes"",""Brent Crude Oil Futures Contracts | Oilprice.com"",""Brent Crude Oil Futures Quotes"",""Brent Crude Oil Futures Price Today - Investing.com"",""Brent Crude Oil Futures Contracts | Oilprice.com"",""Brent Crude Oil Futures Quotes"",""Brent Crude Oil Futures Price Today - Investing.com"",""Brent Crude Oil Futures Quotes"",""Brent Crude Oil Futures Price Today - Investing.com"",""Brent Crude Oil Futures Contracts | Oilprice.com"",""Brent Crude Oil Futures Quotes"",""Brent Crude Oil Futures Contracts | Oilprice.com"",""Brent Crude Oil Futures Price Today - Investing.com"",""Brent Crude Oil Futures Quotes""]",[],2026-03-12T05:11:45.999Z,null,null,"Based on the provided market data, I recommend that traders hold their positions in Brent Crude Oil as the lack of sentiment (0 positive, 0 negative, 0 neutral) and repetitive headlines suggest a stable and potentially neutral market environment with no clear directional bias. This absence of significant news or sentiment shifts indicates that traders should exercise caution and avoid making drastic buy or sell decisions until more conclusive market trends or news emerge."
2026-03-12,oil and LNG,3,0,2,0,"[""What a Middle East oil and LNG crisis means for China and East ..."",""Middle East conflict set to drive oil and LNG prices significantly ..."",""Middle East conflict set to drive oil and LNG prices significantly ...""]",[],2026-03-12T05:10:40.491Z,2026-03-02T09:28:08.000Z,2026-03-05T21:48:51.000Z,"Based on the negative market sentiment and headlines indicating a potential crisis and price increases due to the Middle East conflict, traders are advised to hold or sell their oil and LNG positions as the expected price volatility and upward pressure may lead to unpredictable losses. The lack of positive sentiment and repeated warnings of significant price increases suggest a high-risk trading environment, making it prudent to avoid buying or accumulating more positions at this time."
2026-03-12,Gasoline,9,0,2,1,"[""Fuel price surge would be worse without Trump energy policies: Burgum"",""Fuel price surge would be worse without Trump energy policies: Burgum"",""Fuel price surge would be worse without Trump energy policies: Burgum"",""Gasoline and Diesel Fuel Update"",""Gasoline and Diesel Fuel Update - U.S. Energy Information ..."",""Fuel price surge would be worse without Trump energy policies: Burgum"",""Gasoline and Diesel Fuel Update - U.S. Energy Information ..."",""Fuel price surge would be worse without Trump energy policies: Burgum"",""Gasoline and Diesel Fuel Update - U.S. Energy Information ...""]","[""Traders may consider selling gasoline futures as the current price rise is likely driven by geopolitical tensions, which may be unsustainable in the long term. However, a cautious approach is recommended as prices continue to rise, and traders should closely monitor the situation before making any decisions on gasoline."",""Traders may consider buying gasoline, as prices are expected to continue rising due to the ongoing geopolitical tensions and military strikes on Iran. However, a cautious approach is advised, as the neutral sentiment suggests that the market may be due for a correction, and traders should be prepared to sell if prices show signs of peaking."",""Traders may consider selling gasoline futures as the current price rise is likely driven by geopolitical tensions, which may be unsustainable in the long term. However, a cautious approach is recommended as prices continue to rise, and traders should closely monitor the situation before making any decisions on gasoline.""]",2026-03-12T05:11:05.837Z,2026-03-12T01:38:29.000Z,2026-03-12T01:38:29.000Z,"Based on the market data, I recommend that traders sell or hold Gasoline as the overall sentiment is bearish with 2 negative articles and no positive articles, indicating a potential downward trend in prices. The repetitive headlines about fuel price surges being mitigated by Trump energy policies suggest a defensive tone, which may further contribute to a decline in Gasoline prices."
2026-03-12,West Texas Intermediate (WTI) Oil,2,1,0,1,"[""WTI remains stable above $68.00, poises for a second straight weekly gain"",""WTI remains stable above $68.00, poises for a second straight weekly gain""]","[""Traders may consider holding their positions in WTI oil, as the stable price direction and positive sentiment suggest that the current price level may be maintained. Alternatively, buying WTI oil could be a viable option for those looking to capitalize on potential future gains, given the commodity's current momentum."",""Traders may consider holding their positions in WTI oil, as the stable price direction and neutral sentiment suggest that the commodity is likely to maintain its current level around $68.30 per barrel. There is no clear indication to buy or sell, making a hold strategy the most prudent approach for now.""]",2026-03-12T05:09:30.189Z,2025-03-21T16:55:16.000Z,2025-03-21T16:55:16.000Z,"Based on the stable price above $68.00 and the potential for a second straight weekly gain, traders are recommended to hold or consider buying WTI oil as the overall sentiment suggests a positive outlook. The lack of negative news and the neutral to positive tone of the articles indicate a potential for continued price stability or upward movement, making it a favorable time to maintain or increase positions in WTI oil."
2026-03-12,WTI,1,0,0,0,"[""Oil Update - December 2025 | Seeking Alpha""]",[],2026-03-12T05:11:02.215Z,2025-12-31T12:47:02.000Z,2025-12-31T12:47:02.000Z,"Based on the lack of current sentiment and news articles, traders may want to hold their positions in WTI as there is no clear indication of market direction, and the sole headline referencing a December 2025 update is outdated and unlikely to impact current market prices. Without more recent and relevant information, it's prudent to maintain a neutral stance and await more timely and influential market data before making a buy or sell decision."
2026-03-12,liquefied natural gas,28,0,0,2,"[""The Iran War Is Creating an LNG Shortfall. Don’t Panic Yet"",""A Russian-flagged tanker erupts in a massive fire and sinks off Libya"",""Russian LNG tanker switches route after similar vessel attacked off Libya"",""Liquefied natural gas outlook | J.P. Morgan Research"",""The Iran War Is Creating an LNG Shortfall. Don’t Panic Yet"",""Liquefied natural gas outlook | J.P. Morgan Research"",""Liquefied natural gas outlook | J.P. Morgan Research"",""The Iran War Is Creating an LNG Shortfall. Don’t Panic Yet"",""Uniper shielded from latest Middle East energy crisis, CEO says"",""Liquefied natural gas outlook | J.P. Morgan Research"",""The Iran War Is Creating an LNG Shortfall. Don’t Panic Yet"",""Liquefied Natural Gas Prices 2025 | Price Index & Chart"",""The Iran War Is Creating an LNG Shortfall. Don’t Panic Yet"",""The Iran War Is Creating an LNG Shortfall. Don’t Panic Yet"",""Liquefied Natural Gas Prices 2025 | Price Index & Chart"",""A Russian-flagged tanker erupts in a massive fire and sinks off Libya"",""Global liquefied natural gas market development and future outlook"",""The Iran War Is Creating an LNG Shortfall. Don’t Panic Yet"",""A Russian-flagged tanker erupts in a massive fire and sinks off Libya"",""The Iran War Is Creating an LNG Shortfall. Don’t Panic Yet"",""The Iran War Is Creating an LNG Shortfall. Don’t Panic Yet"",""Liquefied natural gas outlook | J.P. Morgan Research"",""Qatar LNG outage nixes expected global surplus, Morgan Stanley says (UNG:NYSEARCA)"",""A Russian-flagged tanker erupts in a massive fire and sinks off Libya"",""The battle over a global energy transition is on between petro-states ..."",""Liquefied natural gas outlook | J.P. Morgan Research"",""Global liquefied natural gas market development and future outlook"",""Liquefied natural gas outlook | J.P. Morgan Research""]","[""Traders may consider holding or buying LNG (Liquefied Natural Gas) as the Iran war creates a shortfall, but the price direction is not expected to be catastrophic, suggesting a potential opportunity for moderate gains. However, a cautious approach is recommended, as the situation is being closely monitored and the market sentiment remains neutral.""]",2026-03-12T05:11:47.262Z,2025-10-24T00:00:00.000Z,2026-03-11T12:00:59.000Z,"Based on the market data, I recommend that traders hold their positions in liquefied natural gas (LNG) as the current sentiment is neutral and the news headlines suggest a potential shortfall due to the Iran War and recent tanker incidents, which could lead to price volatility. However, the repeated ""Don't Panic Yet"" headlines and lack of overall negative sentiment suggest that the market is not yet reacting strongly to these events, making it a good time to wait and observe before making any major trading decisions."
2026-03-12,US energy,2,0,1,1,"[""Asia's imports of US energy drop in 2025 despite Trump trade moves ..."",""Asia's imports of US energy drop in 2025 despite Trump trade moves ...""]","[""Based on the article, traders are recommended to sell US energy, specifically crude oil or natural gas, as Asia's imports are expected to drop in 2025. This downward trend may lead to a decrease in prices, making it a good time to exit or short positions in US energy commodities."",""Traders are recommended to sell US crude oil as Asia's declining imports are likely to lead to a drop in demand, putting downward pressure on prices. This bearish sentiment suggests that holding or buying US crude oil may not be a favorable strategy at this time, making selling the preferred option.""]",2026-03-12T05:11:13.852Z,2025-12-18T13:00:00.000Z,2025-12-18T13:00:00.000Z,"Based on the market data, I recommend that traders hold or sell US energy commodities as the negative sentiment from Asia's decreased imports in 2025 may indicate a downward trend in demand. The lack of positive sentiment and dominance of neutral to negative news suggests that traders should exercise caution and avoid buying until more favorable market conditions emerge."
2026-03-12,Crude Oil WTI,5,0,0,0,"[""Crude Oil WTI Dec '25 Futures Price - Barchart.com"",""Crude Oil Futures Overview"",""Crude Oil WTI Jan '26 Futures Price - Barchart.com"",""Crude Oil WTI Feb '26 Futures Price - Barchart.com"",""Crude Oil WTI Feb '26 Futures Price - Barchart.com""]",[],2026-03-12T05:11:31.729Z,null,null,"Based on the lack of sentiment in the market data, with no positive, negative, or neutral articles, it's difficult to determine a clear direction for Crude Oil WTI, so traders may want to hold their current positions. Without any significant news or trends to influence the price, it's likely that the market will remain stable, making it a good idea to wait for more information before making a buy or sell decision."
2026-03-12,US oil and natural gas,1,0,0,1,"[""US Oil, Gas Rig Count Slows Despite Record Output, EIA Says - Energy ...""]","[""Based on the article, traders may consider selling U.S. oil as the decline in drilling activity and record-high production could lead to a surplus, putting downward pressure on prices. However, it's essential to keep a close eye on the market, as the neutral sentiment suggests that the decrease in price direction may be limited.""]",2026-03-12T05:10:36.967Z,null,null,"Based on the neutral market sentiment and the headline indicating a slowdown in US oil and gas rig count despite record output, traders may consider holding their current positions as the market appears to be stabilizing. This cautious approach is recommended as the slowdown in rig count could potentially lead to decreased production and higher prices in the future, but the current record output levels may keep prices in check for now."
2026-03-12,Petroleum liquids,2,0,0,0,"[""Petroleum liquids supply growth driven by non-OPEC+ countries in ..."",""Petroleum liquids supply growth driven by non-OPEC+ countries in ...""]",[],2026-03-12T05:11:46.561Z,null,null,"Based on the market data, I recommend that traders hold their positions in petroleum liquids as the lack of sentiment and duplicate headlines suggest a neutral market outlook with no clear direction. The fact that supply growth is driven by non-OPEC+ countries may lead to increased global supply, but without further information, it's best to maintain a cautious stance and wait for more definitive market signals before making a buy or sell decision."
2026-03-12,European natural gas,1,1,0,0,"[""Vermilion Well-Positioned For European Natural Gas Price Spike (NYSE:VET)""]","[""Traders should buy natural gas, as the expected price spike in European markets is likely to drive up prices. This upward trend presents a lucrative opportunity for investors to capitalize on the anticipated increase in natural gas prices, particularly for companies like Vermilion Energy Inc. that are well-positioned to benefit from this surge.""]",2026-03-12T05:08:22.759Z,2026-03-09T21:06:18.000Z,2026-03-09T21:06:18.000Z,"Based on the positive market sentiment, traders are recommended to buy European natural gas as the current outlook suggests a potential price spike, with companies like Vermilion being well-positioned to benefit from this trend. This buying opportunity is driven by the bullish sentiment, which may lead to increased prices and higher returns for investors who enter the market at this time."
2026-03-12,fuel,33,2,17,3,"[""Pain at the pumps will ease in a month or two, billionaire Catsimatidis says"",""Airlines raise fares as Middle East conflict lifts fuel costs, disrupts flights"",""Return to Russian energy would be 'strategic blunder,' EU says — but Moscow smells blood"",""Airlines raise fares as Middle East conflict lifts fuel costs, disrupts flights"",""Canada's Carbon Tax April 2024 Update and Its Impact | Breakthrough"",""Should Keir scrap 5p fuel duty hike? VOTE NOW"",""Return to Russian energy would be 'strategic blunder,' EU says — but Moscow smells blood"",""Hated 5p fuel duty hike is 'under review', Keir Starmer confirms"",""Return to Russian energy would be 'strategic blunder,' EU says — but Moscow smells blood"",""Asia rolls out four-day weeks and work-from-home as emergency measures to solve a fuel crisis caused by Iran war | Fortune"",""Fuel prices and what’s shaping the market | Ag Proud"",""Vladimir Putin’s war machine may finally be running out of fuel ..."",""Airlines raise fares as Middle East conflict lifts fuel costs, disrupts flights"",""Iran war threatens prolonged hit to global energy markets"",""Vladimir Putin’s war machine may finally be running out of fuel ..."",""Airlines raise fares as Middle East conflict lifts fuel costs, disrupts flights"",""Vladimir Putin’s war machine may finally be running out of fuel ..."",""Fuel prices and what’s shaping the market | Ag Proud"",""Iran war threatens prolonged hit to global energy markets"",""Hated 5p fuel duty hike is 'under review', Keir Starmer confirms"",""Maersk redistributes vessel fuel to ensure supplies, as Iran war disrupts flows"",""Fuel prices and what’s shaping the market | Ag Proud"",""Fuel and fertilizer price spikes leave Texas farmers under pressure"",""Return to Russian energy would be 'strategic blunder,' EU says — but Moscow smells blood"",""Fuel and fertilizer price spikes leave Texas farmers under pressure"",""Tracking retail fuel trends: February 2026 | Upside"",""Fuel and fertilizer price spikes leave Texas farmers under pressure"",""Vladimir Putin’s war machine may finally be running out of fuel ..."",""Return to Russian energy would be 'strategic blunder,' EU says — but Moscow smells blood"",""California’s Looming Fuel Crisis: Refiners Are Trying to Warn ..."",""Australia to change fuel quality standards to boost supply"",""Airlines raise fares as Middle East conflict lifts fuel costs, disrupts flights"",""Asia rolls out four-day weeks and work-from-home as emergency measures to solve a fuel crisis caused by Iran war | Fortune""]","[""Based on the positive sentiment and expected price increases, traders are recommended to buy oil, as billionaire Catsimatidis predicts that pain at the pumps will ease in a month or two, suggesting a potential upward trend in the commodity. This buying opportunity may be a good time to invest in oil before prices potentially rise."",""Traders should buy oil as the disruption to the key oil-export corridor is likely to continue driving up prices. This is a bullish trade, taking advantage of the expected increase in oil prices due to the supply chain disruption."",""Traders should buy crude oil as the disruption to the key oil-export corridor is likely to lead to higher prices due to reduced supply. Despite the negative sentiment, the price direction is expected to be upward, making it a good opportunity to go long on crude oil."",""Traders may consider buying oil and gas, as the market is expected to see gradual price improvements in the coming year. However, traders should exercise caution and be prepared for potential seasonal volatility, and consider holding or scaling back positions if global events threaten to disrupt fuel availability and costs."",""Traders should buy oil, as the disruption to the key oil-export corridor is likely to continue driving up prices despite the negative sentiment. This could be a good opportunity to go long on oil, potentially profiting from the expected price increase."",""Traders should buy oil, as the disruption to the key oil-export corridor is likely to drive up prices despite the negative sentiment. This could be a good opportunity to go long on oil, potentially profiting from the expected price increase."",""Traders are recommended to buy oil and gas, as the market sentiment is cautiously positive with expectations of gradual price improvements in the coming year. However, traders should remain cautious and prepared for potential seasonal volatility and global events that may impact prices."",""Traders may consider buying oil and gas, as the market is expected to see gradual price improvements in the coming year. However, traders should exercise caution and be prepared for potential seasonal volatility, and consider holding or scaling back positions if global events threaten to disrupt fuel availability and costs."",""Traders should buy natural gas, as the potential \""fertilizer cliff\"" may lead to increased demand for the commodity, which is a key component in fertilizer production. Despite the negative sentiment, the expected price direction is up, making natural gas a promising buy opportunity."",""Based on the positive sentiment and upward price direction, traders are recommended to buy gasoline futures as the seasonal trends and geopolitical conflict are expected to continue driving fuel prices up. This buying opportunity is specifically focused on gasoline, as it is a key fuel price that has been impacted by the recent market movements."",""Traders should buy natural gas, as the potential \""fertilizer cliff\"" may lead to increased demand for the commodity, which is a key component in fertilizer production. Despite the negative sentiment, the expected price direction is up, making natural gas a promising buy opportunity."",""Traders should buy oil, as the disruption to the key oil-export corridor is expected to drive up prices despite the negative sentiment. This contrarian play could lead to potential gains as the supply chain constraints outweigh bearish market attitudes, leading to higher oil prices.""]",2026-03-12T05:11:51.833Z,2025-10-21T20:46:21.000Z,2026-03-12T04:41:38.000Z,"Based on the market data, I recommend that traders hold or sell fuel commodities as the majority of the articles (17 out of 33) have a negative sentiment, indicating a potential downward trend in fuel prices due to expected easing of prices and geopolitical tensions. The negative headlines, such as airlines raising fares due to Middle East conflict and Iran war threatening global energy markets, also suggest that traders should exercise caution and avoid buying fuel commodities at this time."
2026-03-12,Iranian crude oil,3,0,0,0,"[""Treasury Dismantles Key Elements of Iran’s Energy Export Machine ..."",""Treasury Dismantles Key Elements of Iran’s Energy Export Machine ..."",""Treasury Dismantles Key Elements of Iran’s Energy Export Machine ...""]",[],2026-03-12T05:10:27.264Z,2025-10-09T00:00:00.000Z,2025-10-09T00:00:00.000Z,"Based on the market data, I recommend that traders sell Iranian crude oil as the repeated headlines about the Treasury dismantling key elements of Iran's energy export machine suggest a significant disruption to Iran's oil exports, which could lead to a decrease in global supply and potentially drive up prices, but more likely will lead to a decrease in Iranian crude oil prices due to reduced demand. Traders should consider selling their positions to avoid potential losses due to the expected decline in Iranian crude oil exports and subsequent price volatility."
